{
  "event": "invitee.created",
  "created_at": "2025-06-01T12:34:56Z",
  "created_by": "https://api.calendly.com/users/USER_UUID",
  "payload": {
    "uri": "https://api.calendly.com/scheduled_events/EVT_UUID/invitees/INV_UUID",
    "event": "https://api.calendly.com/scheduled_events/EVT_UUID",
    "email": "guest@example.com",
    "name": "Guest Name",
    "first_name": "Guest",
    "last_name": "Name",
    "timezone": "America/New_York",
    "status": "active",
    "canceled": false,
    "rescheduled": false,
    "cancel_url": "https://calendly.com/cancellations/abc",
    "reschedule_url": "https://calendly.com/reschedules/xyz",
    "questions_and_answers": [
      {
        "question": "What would you like to discuss?",
        "answer": "Project scope"
      }
    ],
    "tracking": {
      "utm_source": "google",
      "utm_medium": "cpc",
      "utm_campaign": "brand_us",
      "utm_term": "calendly",
      "utm_content": "ad-1"
    },
    "created_at": "2025-06-01T12:34:50Z",
    "updated_at": "2025-06-01T12:34:56Z"
  }
}